{
  "schema_version": 1,
  "generated_at": "2026-06-18T15:04:05+00:00",
  "repo_root": "untitled-victorian-vn",
  "entries": [
    {
      "path": ".agents/README.md",
      "kind": "agent-index",
      "title": ".agents/` — rule and skill library",
      "area": ".agents",
      "summary": "This folder holds **agent role definitions** (markdown) and **Cursor skills** (thin wrappers). Nothing here executes automatically except what your IDE loads from project rules or skills.",
      "links": [
        {
          "target": "rules/orchestrator.md",
          "status": "ok"
        },
        {
          "target": "../.agents/skills/orchestrator/SKILL.md",
          "status": "ok"
        },
        {
          "target": "rules/writers_desk.md",
          "status": "ok"
        },
        {
          "target": "../docs/agents/SKILL_CATALOG.md",
          "status": "ok"
        },
        {
          "target": "rules/documentation_steward.md",
          "status": "ok"
        },
        {
          "target": "../.agents/skills/documentation_audit/SKILL.md",
          "status": "ok"
        },
        {
          "target": "rules/victorian_consultant.md",
          "status": "ok"
        },
        {
          "target": "../.agents/skills/historical_check/SKILL.md",
          "status": "ok"
        },
        {
          "target": "../AGENTS.md",
          "status": "ok"
        },
        {
          "target": "../docs/agents/SKILL_CATALOG.md",
          "status": "ok"
        },
        {
          "target": "../docs/agents/SKILL_CATALOG.md",
          "status": "ok"
        },
        {
          "target": "../.agents/skills/scene_direction/SKILL.md",
          "status": "ok"
        },
        {
          "target": "../.guardrails.yml",
          "status": "ok"
        },
        {
          "target": "../docs/agents/SKILL_CATALOG.md",
          "status": "ok"
        },
        {
          "target": "../docs/agents/GETTING_STARTED.md",
          "status": "ok"
        },
        {
          "target": "../docs/agents/PIPELINE_REFERENCE.md",
          "status": "ok"
        },
        {
          "target": "../docs/agents/CONTRACTS.md",
          "status": "ok"
        }
      ],
      "findings": []
    },
    {
      "path": ".agents/rules/adult_market_reviewer.md",
      "kind": "agent-rule",
      "title": "Role: Adult Market Reviewer & Narrative Editor",
      "area": ".agents/rules/adult_market_reviewer.md",
      "summary": "You are a brutally honest, highly analytical market reviewer and narrative editor specializing in the adult visual novel market, specifically the F95zone-style demographic. Your job is to analyze the actual project files",
      "links": [],
      "findings": []
    },
    {
      "path": ".agents/rules/art_agent.md",
      "kind": "agent-rule",
      "title": "Role: Art Production Agent",
      "area": ".agents/rules/art_agent.md",
      "summary": "You are the lead visual designer and Art Production Agent for the Savoy Hotel visual novel. You enforce **aesthetic consistency, style bible alignment, asset schemas, and character visual continuity**. You do not write n",
      "links": [],
      "findings": []
    },
    {
      "path": ".agents/rules/chief_architect.md",
      "kind": "agent-rule",
      "title": "Role: Chief Architect (Ren'Py)",
      "area": ".agents/rules/chief_architect.md",
      "summary": "You are the lead technical architect for the Ren'Py MVP. You enforce **code structure, state discipline, and review quality**. You coordinate both the `prod_code_agent` (for safe code promotion to production) and the `no",
      "links": [],
      "findings": []
    },
    {
      "path": ".agents/rules/convergent_writer.md",
      "kind": "agent-rule",
      "title": "Role: Convergent Writer (Red Pen Synthesis)",
      "area": ".agents/rules/convergent_writer.md",
      "summary": "You are the **convergent synthesis** stage: a traditional writers' room editor with a red pen. You take the divergent pool's spec scripts, select and merge the **best** ideas into a single promotion-ready non-canon draft",
      "links": [],
      "findings": []
    },
    {
      "path": ".agents/rules/dev_bible.md",
      "kind": "agent-rule",
      "title": "Studio development bible (agent pointer)",
      "area": ".agents/rules/dev_bible.md",
      "summary": "**Canonical copy:** [`docs/dev_bible.md`](../../docs/dev_bible.md)",
      "links": [
        {
          "target": "../../docs/dev_bible.md",
          "status": "ok"
        }
      ],
      "findings": []
    },
    {
      "path": ".agents/rules/divergent_writer_base.md",
      "kind": "agent-rule",
      "title": "Role: Divergent Writer (Base Persona)",
      "area": ".agents/rules/divergent_writer_base.md",
      "summary": "You are one voice in a **writers' room brainstorming pool**. Your job is to advance story and dialogue with **creative divergence** — bold beats, sharp lines, and scene ideas that fit your specialty lens. You do not synt",
      "links": [],
      "findings": []
    },
    {
      "path": ".agents/rules/divergent_writer_personas.md",
      "kind": "agent-rule",
      "title": "Divergent Writer Personas (Extensions)",
      "area": ".agents/rules/divergent_writer_personas.md",
      "summary": "Each invocation uses **one** persona. Filename persona slug must match the table.",
      "links": [],
      "findings": []
    },
    {
      "path": ".agents/rules/documentation_steward.md",
      "kind": "agent-rule",
      "title": "Role: Documentation Steward",
      "area": ".agents/rules/documentation_steward.md",
      "summary": "You keep the repository's documentation synchronized with the current project state.",
      "links": [],
      "findings": []
    },
    {
      "path": ".agents/rules/forensic_psychology_consultant.md",
      "kind": "agent-rule",
      "title": "Role: Forensic Psychology Consultant",
      "area": ".agents/rules/forensic_psychology_consultant.md",
      "summary": "You are the forensic psychology consultant for the narrative pipeline. You evaluate whether character choices, player-facing branches, dialogue, avoidance patterns, escalation, attachment behavior, moral compromise, and ",
      "links": [],
      "findings": []
    },
    {
      "path": ".agents/rules/gatekeeper_orchestrator.md",
      "kind": "agent-rule",
      "title": "Role: Gatekeeper Orchestrator (Meta-Agent)",
      "area": ".agents/rules/gatekeeper_orchestrator.md",
      "summary": "You coordinate the specialist agents during the review pipeline. You do not generate content. You manage validation flow.",
      "links": [],
      "findings": []
    },
    {
      "path": ".agents/rules/lead_narrative_editor.md",
      "kind": "agent-rule",
      "title": "Role: Lead Narrative Editor & Lorekeeper",
      "area": ".agents/rules/lead_narrative_editor.md",
      "summary": "You are the final defense against plot holes, anachronisms, and character inconsistencies. You do not generate new story beats. You validate, correct, and enforce canon.",
      "links": [],
      "findings": []
    },
    {
      "path": ".agents/rules/non_prod_code_agent.md",
      "kind": "agent-rule",
      "title": "Role: Non-Prod Code Agent (Exploratory / Spec Code)",
      "area": ".agents/rules/non_prod_code_agent.md",
      "summary": "You implement approved drafts and explore new mechanics strictly inside the non-production directories (`main-game/draft/` or `main-game/pipeline/`). You write clean Ren'Py/Python structures wrapping narrative content. Y",
      "links": [
        {
          "target": "../../docs/contracts/book_writing_contract.md",
          "status": "ok"
        },
        {
          "target": "../../docs/contracts/book_writing_contract.md",
          "status": "ok"
        }
      ],
      "findings": []
    },
    {
      "path": ".agents/rules/orchestrator.md",
      "kind": "agent-rule",
      "title": "Role: Production Orchestrator",
      "area": ".agents/rules/orchestrator.md",
      "summary": "You decompose a natural-language production task into an ordered sequence of specialist agent",
      "links": [
        {
          "target": "../../.agents/skills/orchestrator/SKILL.md",
          "status": "ok"
        },
        {
          "target": "writers_desk.md",
          "status": "ok"
        },
        {
          "target": "../../docs/agents/SKILL_CATALOG.md",
          "status": "ok"
        },
        {
          "target": "documentation_steward.md",
          "status": "ok"
        },
        {
          "target": "../../.agents/skills/documentation_audit/SKILL.md",
          "status": "ok"
        },
        {
          "target": "../../.agents/skills/spiciness_tuner/SKILL.md",
          "status": "ok"
        },
        {
          "target": "../../.agents/skills/writer_write_scene/SKILL.md",
          "status": "ok"
        },
        {
          "target": "writers_desk.md",
          "status": "ok"
        },
        {
          "target": "../../.agents/skills/writer_add_flag/SKILL.md",
          "status": "ok"
        },
        {
          "target": "../../.agents/skills/writer_add_effect/SKILL.md",
          "status": "ok"
        }
      ],
      "findings": []
    },
    {
      "path": ".agents/rules/prod_code_agent.md",
      "kind": "agent-rule",
      "title": "Role: Prod Code Agent (Promotion)",
      "area": ".agents/rules/prod_code_agent.md",
      "summary": "You promote approved non-canon drafts and framework additions from `main-game/draft/` into production files inside `main-game/prod-game/game/` and `main-game/canon/`. You ensure absolute technical compliance and preserve",
      "links": [],
      "findings": []
    },
    {
      "path": ".agents/rules/README.md",
      "kind": "agent-rule",
      "title": "Agent rule files",
      "area": ".agents/rules/README.md",